<?xml version="1.0" encoding="utf-8"?>
<mediaArts id="3aca5da4-6f94-43a0-9817-5f413d16f000"
    xmlns:xsi="http://www.w3.org/2001/XMLSchema-instance"
    xsi:noNamespaceSchemaLocation="MediaArts.xsd">  
    <item id="3aca5da4-6f94-43a0-9817-5f413d16f100">
        <image file="SmallArrow.gif">
            <altText>A Small Arrow</altText>
        </image>
    </item>
    <item id="3aca5da4-6f94-43a0-9817-5f413d16f101">
        <image file="ArrowNormal.png">
            <altText>Arrow Normal</altText>
        </image>
    </item>
    <item id="3aca5da4-6f94-43a0-9817-5f413d16f110">
        <image file="Warning.png">
            <altText>Warming</altText>
        </image>
    </item>
    <item id="3aca5da4-6f94-43a0-9817-5f413d16f112">
        <image file="SmallWarning.png">
            <altText>Warming</altText>
        </image>
    </item>
    <item id="3aca5da4-6f94-43a0-9817-5f413d16f113">
        <image file="Information.png">
            <altText>Information</altText>
        </image>
    </item>
    <item id="3aca5da4-6f94-43a0-9817-5f413d16f114">
        <image file="Question.png">
            <altText>Question</altText>
        </image>
    </item>
    <item id="3aca5da4-6f94-43a0-9817-5f413d16f115">
        <image file="Error.png">
            <altText>Error</altText>
        </image>
    </item>
</mediaArts>
